uri,track_number,track_name,album,artist,explicit,danceability,energy,key,loudness,speechiness,acousticness,instrumentalness,liveness,valence,tempo,duration_ms,lyrics,lyrics-url
spotify:track:0Om9WAB5RS09L80DyOfTNa,1,Tim McGraw,Taylor Swift,Taylor Swift,False,0.58,0.491,0,-6.462,0.0251,0.575,0.0,0.121,0.425,76.009,232107,"['TranslationsTürkçeEspañolFrançaisTim McGraw Lyrics[Verse 1]', 'He said the way my blue eyes shined', 'Put those Georgia stars to shame that night', 'I said, ""That\'s a lie""', 'Just a boy in a Chevy truck', ""That had a tendency of gettin' stuck"", 'On backroads at night', 'And I was right there beside him all summer long', 'And then the time we woke up to find that summer gone', '', '[Chorus]', 'But when you think Tim McGraw', 'I hope you think my favorite song', 'The one we danced to all night long', 'The moon like a spotlight on the lake', 'When you think happiness', 'I hope you think that little black dress', 'Think of my head on your chest', 'And my old faded blue jeans', 'When you think Tim McGraw', 'I hope you think of me', '[Verse 2]', 'September saw a month of tears', ""And thankin' God that you weren't here"", 'To see me like that', 'But in a box beneath my bed', 'Is a letter that you never read', 'From three summers back', ""It's hard not to find it all a little bittersweet"", ""And lookin' back on all of that, it's nice to believe"", '', '[Chorus]', 'When you think Tim McGraw', 'I hope you think my favorite song', 'The one we danced to all night long', 'The moon like a spotlight on the lake', 'When you think happiness', 'I hope you think that little black dress', 'Think of my head on your chest', 'And my old faded blue jeans', 'When you think Tim McGraw', 'I hope you think of me', '', '[Bridge]', ""And I'm back for the first time since then"", ""I'm standin' on your street"", ""And there's a letter left on your doorstep"", ""And the first thing that you'll read is:"", '""When you think Tim McGraw', 'I hope you think my favorite song', ""Someday you'll turn your radio on"", 'I hope it takes you back to that place""', 'You might also like[Chorus]', 'When you think happiness', 'I hope you think that little black dress', 'Think of my head on your chest', 'And my old faded blue jeans', 'When you think Tim McGraw', 'I hope you think of me', 'Oh, think of me', 'Mmmm', '', '[Outro]', 'He said the way my blue eyes shine', 'Put those Georgia stars to shame that night', 'I said, ""That\'s a lie""25Embed']",https://genius.com/Taylor-swift-tim-mcgraw-lyrics
spotify:track:32mVHdy0bi1XKgr0ajsBlG,2,Picture To Burn,Taylor Swift,Taylor Swift,False,0.658,0.877,7,-2.098,0.0323,0.173,0.0,0.0962,0.821,105.586,173067,"['TranslationsEspañolPicture to Burn Lyrics[Verse 1]', ""State the obvious, I didn't get my perfect fantasy"", 'I realize you love yourself more than you could ever love me', ""So go and tell your friends that I'm obsessive and crazy"", ""That's fine, you won't mind if I say"", 'By the way', '', '[Chorus]', 'I hate that stupid old pickup truck you never let me drive', ""You're a redneck heartbreak who's really bad at lying"", 'So watch me strike a match on all my wasted time', ""As far as I'm concerned, you're just another picture to burn"", '[Verse 2]', ""There's no time for tears"", ""I'm just sitting here planning my revenge"", ""There's nothing stopping me"", 'From going out with all of your best friends', 'And if you come around saying sorry to me', ""My daddy's gonna show you how sorry you'll be"", '', '[Chorus]', ""'Cause I hate that stupid old pickup truck you never let me drive"", ""You're a redneck heartbreak who's really bad at lying"", 'So watch me strike a match on all my wasted time', ""As far as I'm concerned, you're just another picture to burn"", '', '[Bridge]', ""And if you're missing me, you'd better keep it to yourself"", ""'Cause coming back around here would be bad for your health"", '', '[Chorus]', ""'Cause I hate that stupid old pickup truck you never let me drive"", ""You're a redneck heartbreak who's really bad at lying"", 'So watch me strike a match on all my wasted time', ""In case you haven't heard"", 'I really really hate that', 'Stupid old pickup truck you never let me drive', ""You're a redneck heartbreak, who's really bad at lying"", 'So watch me strike a match on all my wasted time', ""As far as I'm concerned, you're just another picture to burn"", 'You might also like[Outro]', 'Burn, burn, burn, baby, burn', ""You're just another picture to burn"", 'Baby, burn31Embed']",https://genius.com/Taylor-swift-picture-to-burn-lyrics
spotify:track:7zMcNqs55Mxer82bvZFkpg,3,Teardrops On My Guitar - Radio Single Remix,Taylor Swift,Taylor Swift,False,0.621,0.417,10,-6.941,0.0231,0.288,0.0,0.119,0.289,99.953,203040,"['TranslationsEspañolFrançaisTeardrops On My Guitar Lyrics[Verse 1]', 'Drew looks at me', ""I fake a smile so he won't see"", ""That I want and I'm needing"", 'Everything that we should be', '', '[Pre-Chorus]', ""I'll bet she's beautiful"", 'That girl he talks about', ""And she's got everything that I have to live without"", '[Verse 2]', 'Drew talks to me', ""I laugh 'cause it's just so funny"", ""That I can't even see"", ""Anyone when he's with me"", '', '[Pre-Chorus]', ""He says he's so in love"", ""He's finally got it right"", ""I wonder if he knows he's all I think about at night"", '', '[Chorus]', ""He's the reason for the teardrops on my guitar"", 'The only thing that keeps me wishing on a wishing star', ""He's the song in the car I keep singing"", ""Don't know why I do"", '', '[Verse 3]', 'Drew walks by me', ""Can he tell that I can't breathe?"", 'And there he goes, so perfectly', 'The kind of flawless I wish I could be', '', '[Pre-Chorus]', ""She'd better hold him tight"", 'Give him all her love', ""Look in those beautiful eyes and know she's lucky 'cause"", 'You might also like[Chorus]', ""He's the reason for the teardrops on my guitar"", 'The only thing that keeps me wishing on a wishing star', ""He's the song in the car I keep singing"", ""Don't know why I do"", '', '[Bridge]', 'So I drive home alone', 'As I turn off the light', ""I'll put his picture down and maybe get some sleep tonight"", '', '[Chorus]', ""'Cause he's the reason for the teardrops on my guitar"", 'The only one who’s got enough for me to break my heart', ""He's the song in the car I keep singing"", ""Don't know why I do"", ""He's the time taken up, but there's never enough"", ""And he's all that I need to fall into"", '', '[Outro]', 'Drew looks at me', ""I fake a smile so he won't see51Embed""]",https://genius.com/Taylor-swift-teardrops-on-my-guitar-lyrics
spotify:track:73OX8GdpOeGzKC6OvGSbsv,4,A Place in this World,Taylor Swift,Taylor Swift,False,0.576,0.777,9,-2.881,0.0324,0.051,0.0,0.32,0.428,115.028,199200,"['TranslationsFrançaisA Place In This World Lyrics[Verse 1]', ""I don't know what I want, so don't ask me"", ""'Cause I'm still trying to figure it out"", ""Don't know what's down this road, I'm just walking"", 'Trying to see through the rain coming down', ""Even though I'm not the only one"", 'Who feels the way I do', '', '[Chorus]', ""I'm alone, on my own, and that's all I know"", ""I'll be strong, I'll be wrong, oh but life goes on"", ""Oh, I'm just a girl, trying to find a place in this world"", '[Verse 2]', 'Got the radio on, my old blue jeans', ""And I'm wearing my heart on my sleeve"", 'Feeling lucky today, got the sunshine', 'Could you tell me what more do I need', ""And tomorrow's just a mystery, oh yeah"", ""But that's okay"", '', '[Chorus]', ""I'm alone, on my own, and that's all I know"", ""I'll be strong, I'll be wrong, oh but life goes on"", ""Oh, I'm just a girl, trying to find a place in this world"", '', '[Bridge]', ""Maybe I'm just a girl on a mission"", ""But I'm ready to fly"", '', '[Chorus]', ""I'm alone, on my own, and that's all I know"", ""I'll be strong, I'll be wrong, oh but life goes on"", ""Oh I'm alone, on my own, and that's all I know"", ""Oh I'm just a girl, trying to find a place in this world"", '', '[Outro]', ""Oh I'm just a girl"", ""Oh I'm just a girl, oh, oh"", ""Oh I'm just a girlYou might also like16Embed""]",https://genius.com/Taylor-swift-a-place-in-this-world-lyrics
spotify:track:7an1exwMnfYRcdVQm0yDev,5,Cold As You,Taylor Swift,Taylor Swift,False,0.418,0.482,5,-5.769,0.0266,0.217,0.0,0.123,0.261,175.558,239013,"['TranslationsFrançaisCold as You Lyrics[Verse 1]', 'You have a way of coming easily to me', 'And when you take, you take the very best of me', 'So I start a fight cause I need to feel something', ""And you do what you want 'cause I'm not what you wanted"", '', '[Chorus]', 'Oh, what a shame, what a rainy ending given to a perfect day', ""Just walk away, ain't no use defending words that you will never say"", ""And now that I'm sitting here thinking it through"", ""I've never been anywhere cold as you"", '[Verse 2]', 'You put up walls and paint them all a shade of gray', 'And I stood there loving you and wished them all away', 'And you come away with a great little story', 'Of a mess of a dreamer with the nerve to adore you', '', '[Chorus]', 'Oh, what a shame, what a rainy ending given to a perfect day', ""So just walk away, ain't no use defending words that you will never say"", ""And now that I'm sitting here thinking it through"", ""I've never been anywhere cold as you"", '', '[Bridge]', 'You never did give a damn thing, honey, but I cried, cried for you', ""And I know you wouldn't have told nobody if I died, died for you"", '(Died for you)', '', '[Chorus]', 'Oh, what a shame, what a rainy ending given to a perfect day', 'Every smile you fake is so condescending', 'Counting all the scars you made', ""And now that I'm sitting here thinking it through"", ""I've never been anywhere cold as you"", 'OohYou might also like17Embed']",https://genius.com/Taylor-swift-cold-as-you-lyrics
spotify:track:2QA3IixpRcKyOdG7XDzRgv,6,The Outside,Taylor Swift,Taylor Swift,False,0.589,0.805,5,-4.055,0.0293,0.00491,0.0,0.24,0.591,112.982,207107,"['TranslationsFrançaisThe Outside Lyrics[Verse 1]', ""I didn't know what I would find"", 'When I went looking for a reason, I know', ""I didn't read between the lines"", ""And, baby, I've got nowhere to go"", '', '[Pre-Chorus]', 'I tried to take the road less traveled by', 'But nothing seems to work the first few times', 'Am I right?', '[Chorus]', 'So how can I ever try to be better?', 'Nobody ever lets me in', ""I can still see you, this ain't the best view"", 'On the outside looking in', ""I've been a lot of lonely places"", ""I've never been on the outside"", '', '[Verse 2]', 'You saw me there, but never knew', 'That I would give it all up to be', 'A part of this, a part of you', ""And now it's all too late, so you see"", '', '[Pre-Chorus]', ""You could've helped if you had wanted to"", ""But no one notices until it's too"", 'Late to do anything', '', '[Chorus]', 'How can I ever try to be better?', 'Nobody ever lets me in', ""I can still see you, this ain't the best view"", 'On the outside looking in', ""I've been a lot of lonely places"", ""I've never been on the outside"", 'You might also like[Post-Chorus]', 'Oh, yeah', '', '[Chorus]', 'How can I ever try to be better?', 'Nobody ever lets me in', ""And I can still see you, this ain't the best view"", 'On the outside looking in', ""I've been a lot of lonely places"", ""I've never been on the outside"", '', '[Outro]', 'Oh-oh', 'Oh, oh-oh', 'Oh-oh', 'Oh-oh8Embed']",https://genius.com/Taylor-swift-the-outside-lyrics
spotify:track:6K0CJLVXqbGMeJSmJ4ENKK,7,Tied Together with a Smile,Taylor Swift,Taylor Swift,False,0.479,0.578,2,-4.963,0.0294,0.525,0.0,0.0841,0.192,146.165,248107,"['Tied Together with a Smile Lyrics[Verse 1]', ""Seems the only one who doesn't see your beauty"", 'Is the face in the mirror looking back at you', ""You walk around here thinking you're not pretty"", ""But that's not true"", ""'Cause I know you"", '', '[Chorus]', ""Hold on, baby, you're losing it"", ""The water's high, you're jumping into it and letting go"", 'And no one knows', ""That you cry, but you don't tell anyone"", 'That you might not be the golden one', ""And you're tied together with a smile"", ""But you're coming undone, oh"", '[Verse 2]', ""I guess it's true that love was all you wanted"", ""'Cause you're giving it away like it's extra change"", 'Hoping it will end up in his pocket (Pocket)', 'But he leaves you out like a penny in the rain', ""Oh, 'cause it's not his price to pay"", ""It's not his price to pay"", '', '[Chorus]', ""Hold on, baby, you're losing it"", ""The water's high, you're jumping into it and letting go"", 'And no one knows', ""That you cry, but you don't tell anyone"", 'That you might not be the golden one', ""And you're tied together with a smile"", ""But you're coming undone, oh"", 'Oh, oh', '', '[Chorus]', ""Hold on, baby, you're losing it"", ""The water's high, you're jumping into it and letting go"", 'And no one knows', ""That you cry but you don't tell anyone"", 'That you might not be the golden one', ""And you're tied together with a smile"", ""But you're coming undone, oh"", 'You might also like[Outro]', ""You're tied together with a smile"", ""But you're coming undone, oh, oh-oh"", 'Goodbye, baby', 'With a smile, baby, baby', 'Oh12Embed']",https://genius.com/Taylor-swift-tied-together-with-a-smile-lyrics
spotify:track:2ZoOmCSgj0ypVAmGd1ve4y,8,Stay Beautiful,Taylor Swift,Taylor Swift,False,0.594,0.629,8,-4.919,0.0246,0.0868,0.0,0.137,0.504,131.597,236053,"['TranslationsFrançaisEspañolStay Beautiful Lyrics[Verse 1]', ""Corey's eyes are like a jungle"", ""He smiles, it's like the radio"", 'He whispers songs into my window', 'In words that nobody knows', ""There's pretty girls on every corner"", ""They watch him as he's walking home"", 'Saying, ""Does he know?""', 'Will you ever know?', '', '[Chorus]', ""You're beautiful, every little piece, love"", ""Don't you know you're really gonna be someone?"", 'Ask anyone', 'And when you find everything you looked for', 'I hope your life leads you back to my door', ""Oh, but if it don't"", 'Stay beautiful', '[Verse 2]', 'Cory finds another way to be', 'The highlight of my day', ""I'm taking pictures in my mind"", ""So I can save 'em for a rainy day"", ""It's hard to make a conversation"", ""When he's taking my breath away"", 'I should say, ""Hey, by the way""', '', '[Chorus]', ""You're beautiful, every little piece, love"", ""Don't you know you're really gonna be someone?"", 'Ask anyone', 'And when you find everything you looked for', 'I hope your life leads you back to my door', ""Oh, but if it don't"", 'Stay beautiful', '', '[Bridge]', 'If you and I are a story', 'That never gets told', 'If what you are is a daydream', ""I'll never get to hold, at least you'll know"", '', '[Chorus]', ""You're beautiful, every little piece, love"", ""Don't you know you're really gonna be someone?"", 'Ask anyone', 'And when you find everything you looked for', 'I hope your life leads you back to my front door', ""Oh, but if it don't"", 'Will you stay beautiful, beautiful, beautiful?', 'Beautiful, beautiful, beautiful', 'You might also like[Outro]', 'La-la-la', 'Oh-oh-oh', 'Oh-oh-oh-oh', ""Oh, but if it don't"", 'Stay beautiful, stay beautiful', 'Na-na-na, na-na21Embed']",https://genius.com/Taylor-swift-stay-beautiful-lyrics
spotify:track:16MVSD0mGI4RMQT83Qzm69,9,Should've Said No,Taylor Swift,Taylor Swift,False,0.476,0.777,4,-3.771,0.0289,0.0103,0.0,0.196,0.472,167.964,242200,"['TranslationsСрпскиFrançaisShould’ve Said No Lyrics[Verse 1]', ""It's strange to think the songs we used to sing"", 'The smiles, the flowers, everything is gone', 'Yesterday, I found out about you', ""Even now, just lookin' at you feels wrong"", '', '[Pre-Chorus]', ""You say that you'd take it all back"", 'Given one chance', 'It was a moment of weakness', 'And you said yes', '[Chorus]', ""You should've said no, you should've gone home"", ""You should've thought twice 'fore you let it all go"", ""You should've known that word"", ""'Bout what you did with her'd get back to me (Get back to me)"", ""And I should've been there, in the back of your mind"", ""I shouldn't be asking myself why"", ""You shouldn't be begging for forgiveness at my feet"", ""You should've said no"", 'Baby, and you might still have me', '', '[Verse 2]', ""You can see that I've been cryin'"", 'And baby, you know all the right things to say', 'But do you honestly expect me to believe', 'We could ever be the same?', '', '[Pre-Chorus]', 'You say that the past is the past', 'You need one chance', 'It was a moment of weakness', 'And you said yes', '', '[Chorus]', ""You should've said no, you should've gone home"", ""You should've thought twice 'fore you let it all go"", ""You should've known that word"", ""'Bout what you did with her’d get back to me (Get back to me)"", ""And I should've been there, in the back of your mind"", ""I shouldn't be asking myself why"", ""You shouldn't be begging for forgiveness at my feet"", ""You should've said no"", 'Baby, and you might still have me', 'Oh, oh', 'You might also like[Bridge]', ""I can't resist"", 'Before you go, tell me this', 'Was it worth it?', 'Was she worth this?', 'No, no', 'No, no, no, no', '', '[Chorus]', ""You should've said no, you should've gone home"", ""You should've thought twice 'fore you let it all go"", ""You should've known that word"", ""'Bout what you did with her’d get back to me (Get back to me)"", ""And I should've been there, in the back of your mind"", ""I shouldn't be asking myself why"", ""You shouldn't be begging for forgiveness at my feet"", ""You should've said no"", 'Baby, and you might still have me28Embed']",https://genius.com/Taylor-swift-shouldve-said-no-lyrics
spotify:track:2QrQCMel6v2JiLxqrg4p2O,10,Mary's Song (Oh My My My),Taylor Swift,Taylor Swift,False,0.403,0.627,2,-5.28,0.0292,0.0177,0.0,0.182,0.374,74.9,213080,"['TranslationsEspañolMary’s Song (Oh My My My) Lyrics[Verse 1]', 'She said I was seven and you were nine', 'I looked at you like the stars that shined', 'In the sky, the pretty lights', 'And our daddies used to joke about the two of us', 'Growing up and falling in love', 'And our mamas smiled and rolled their eyes', 'And said, ""Oh, my, my, my""', '', '[Chorus]', 'Take me back to the house in the backyard tree', ""Said you'd beat me up, you were bigger than me"", 'You never did, you never did', 'Take me back when our world was one block wide', 'I dared you to kiss me and ran when you tried', 'Just two kids, you and I', 'Oh, my, my, my, my', '[Verse 2]', 'Well, I was sixteen when suddenly', ""I wasn't that little girl you used to see"", 'But your eyes still shined like pretty lights', 'And our daddies used to joke about the two of us', ""They never believed we'd really fall in love"", 'And our mamas smiled and rolled their eyes', 'And said, ""Oh, my, my, my""', '', '[Chorus]', 'Take me back to the creek beds we turned up', '2 a.m. riding in your truck', 'And all I need is you next to me', 'Take me back to the time we had our very first fight', ""The slamming of doors 'stead of kissing goodnight"", ""You stayed outside 'til the morning light"", 'Oh, my, my, my, my', '', '[Bridge]', 'A few years had gone and come around', 'We were sitting at our favorite spot in town', 'And you looked at me, got down on one knee', '', '[Chorus]', 'Take me back to the time when we walked down the aisle', 'Our whole town came and our mamas cried', 'You said, ""I do,"" and I did, too', 'Take me home where we met so many years before', ""We'll rock our babies on that very front porch"", 'After all this time, you and I', 'You might also like[Outro]', ""And I'll be eighty-seven, you'll be eighty-nine"", ""I'll still look at you like the stars that shine"", 'In the sky, oh, my, my, my14Embed']",https://genius.com/Taylor-swift-marys-song-oh-my-my-my-lyrics
spotify:track:15DeqWWQB4dcEWzJg15VrN,11,Our Song,Taylor Swift,Taylor Swift,False,0.668,0.672,2,-4.931,0.0303,0.111,0.0,0.329,0.539,89.011,201107,"['TranslationsFrançaisOur Song Lyrics[Verse 1]', ""I was ridin' shotgun with my hair undone"", 'In the front seat of his car', ""He's got a one-hand feel on the steering wheel"", 'The other on my heart', 'I look around, turn the radio down', 'He says, ""Baby, is something wrong?""', 'I say, ""Nothin\', I was just thinkin\'', 'How we don\'t have a song""', 'And he says', '[Chorus]', 'Our song is the slamming screen door', ""Sneakin' out late, tapping on your window"", ""When we're on the phone and you talk real slow"", ""'Cause it's late and your mama don't know"", 'Our song is the way you laugh', 'The first date: ""Man, I didn\'t kiss her, and I should have""', ""And when I got home, 'fore I said amen"", ""Askin' God if he could play it again"", '', '[Verse 2]', 'I was walking up the front porch steps', 'After everything that day', 'Had gone all wrong or been trampled on', 'And lost and thrown away', 'Got to the hallway, well on my way', ""To my lovin' bed"", ""I almost didn't notice all the roses"", 'And the note that said', '', '[Chorus]', 'Our song is the slamming screen door', ""Sneakin' out late, tapping on your window"", ""When we're on the phone and you talk real slow"", ""'Cause it's late and your mama don't know"", 'Our song is the way you laugh', 'The first date: ""Man, I didn\'t kiss her, and I should have""', ""And when I got home, 'fore I said amen"", ""Askin' God if he could play it again"", 'You might also like[Post-Chorus]', 'Da-da-da-da', '', '[Bridge]', ""I've heard every album, listened to the radio"", ""Waited for somethin' to come along"", 'That was as good as our song', '', '[Chorus]', ""'Cause our song is the slamming screen door"", ""Sneakin' out late, tappin' on his window"", ""When we're on the phone and he talks real slow"", ""'Cause it's late and his mama don't know"", 'Our song is the way he laughs', 'The first date: ""Man, I didn\'t kiss him, and I should have""', ""And when I got home, 'fore I said amen"", ""Askin' God if he could play it again"", '', '[Post-Chorus]', 'Play it again, oh, yeah', 'Oh, oh, yeah', '', '[Outro]', ""I was ridin' shotgun with my hair undone"", 'In the front seat of his car', 'I grabbed a pen and an old napkin', 'And I wrote down our song34Embed']",https://genius.com/Taylor-swift-our-song-lyrics
spotify:track:0JIdBrXGSJXS72zjF9ss9u,12,I'm Only Me When I'm With You,Taylor Swift,Taylor Swift,False,0.563,0.934,8,-3.629,0.0646,0.00452,0.000807,0.103,0.518,143.964,213053,"['TranslationsFrançaisI’m Only Me When I’m With You Lyrics[Verse 1]', 'Friday night beneath the stars', 'In a field behind your yard', 'You and I are painting pictures in the sky', ""And sometimes, we don't say a thing"", 'Just listen to the crickets sing', 'Everything I need is right here by my side', '', '[Pre-Chorus]', 'And I know everything about you', ""I don't wanna live without you"", '[Chorus]', ""I'm only up when you're not down"", ""Don't wanna fly if you're still on the ground"", ""It's like no matter what I do"", 'Well, you drive me crazy half the time', ""The other half, I'm only tryin' to"", 'Let you know that what I feel is true', ""And I'm only me when I'm with you"", '', '[Verse 2]', 'Just a small-town boy and girl', ""Livin' in a crazy world"", ""Tryna figure out what is and isn't true"", ""And I don't try to hide my tears"", 'My secrets or my deepest fears', 'Through it all, nobody gets me like you do', '', '[Pre-Chorus]', 'And you know everything about me', ""You say that you can't live without me"", '', '[Chorus]', ""I'm only up when you're not down"", ""Don't wanna fly if you're still on the ground"", ""It's like no matter what I do"", 'Well, you drive me crazy half the time', ""The other half, I'm only tryin' to"", 'Let you know that what I feel is true', ""And I'm only me when I'm with you"", 'You might also like[Bridge]', ""When I'm with anybody else"", ""It's so hard to be myself"", 'And only you can tell', '', '[Chorus]', ""That I'm only up when you're not down"", ""Don't wanna fly if you're still on the ground"", ""It's like no matter what I do"", 'Well, you drive me crazy half the time', ""The other half, I'm only tryin' to"", 'Let you know that what I feel is true', ""And I'm only me"", 'Who I wanna be', ""Well, I'm only me when I'm with you"", '', '[Outro]', 'With you', 'Uh-huh-huh, yeah10Embed']",https://genius.com/Taylor-swift-im-only-me-when-im-with-you-lyrics
