uri,track_number,track_name,album,artist,explicit,danceability,energy,key,loudness,speechiness,acousticness,instrumentalness,liveness,valence,tempo,duration_ms,lyrics,lyrics-url
spotify:track:12M5uqx0ZuwkpLp5rJim1a,9,Cornelia Street,Lover,Taylor Swift,False,0.824,0.624,0,-9.728,0.0827,0.781,0.000189,0.1,0.248,102.012,287267,"['TranslationsEspañolHrvatskiPortuguêsPolskiItalianoCornelia Street Lyrics[Verse 1]', 'We were in the backseat', 'Drunk on something stronger than the drinks in the bar', '""I rent\u2005a\u2005place on Cornelia\u2005Street""', 'I say casually in the car', 'We\u2005were a fresh page on the desk', 'Filling in the blanks as we go', 'As if the street lights pointed in an arrow head', 'Leading us home', '', '[Chorus]', 'And I hope I never lose you, hope it never ends', ""I'd never walk Cornelia Street again"", ""That's the kinda heartbreak time could never mend"", ""I'd never walk Cornelia Street again"", 'And baby, I get mystified by how this city screams your name', ""And baby, I'm so terrified of if you ever walk away"", ""I'd never walk Cornelia Street again"", ""I'd never walk Cornelia Street again"", '[Verse 2]', 'Windows flung right open, autumn air', ""Jacket 'round my shoulders is yours"", 'We bless the rains on Cornelia Street', 'Memorize the creaks in the floor', 'Back when we were card sharks, playing games', 'I thought you were leading me on', 'I packed my bags, left Cornelia Street', 'Before you even knew I was gone', '', '[Pre-Chorus]', 'But then you called, showed your hand', 'I turned around before I hit the tunnel', 'Sat on the roof, you and I', '', '[Chorus]', 'I hope I never lose you, hope it never ends', ""I'd never walk Cornelia Street again"", ""That's the kinda heartbreak time could never mend"", ""I'd never walk Cornelia Street again"", 'And baby, I get mystified by how this city screams your name', ""And baby, I'm so terrified of if you ever walk away"", ""I'd never walk Cornelia Street again"", ""I'd never walk Cornelia Street again"", '[Bridge]', 'You hold my hand on the street', 'Walk me back to that apartment', 'Years ago, we were just inside', 'Barefoot in the kitchen', 'Sacred new beginnings', 'That became my religion, listen', 'You might also like[Chorus]', 'I hope I never lose you', ""I'd never walk Cornelia Street again"", 'Oh, never again', 'And baby, I get mystified by how this city screams your name', ""And baby, I'm so terrified of if you ever walk away"", ""I'd never walk Cornelia Street again"", ""I'd never walk Cornelia Street again"", '', '[Post-Chorus]', ""I don't wanna lose you (Hope it never ends)"", ""I'd never walk Cornelia Street again"", ""I don't wanna lose you (Yeah)"", '', '[Outro]', '""I rent a place on Cornelia Street""', 'I say casually in the car57Embed']",https://genius.com/Taylor-swift-cornelia-street-lyrics
spotify:track:2dgFqt3w9xIQRjhPtwNk3D,10,Death By A Thousand Cuts,Lover,Taylor Swift,False,0.712,0.732,4,-6.754,0.0629,0.454,0.0,0.319,0.313,94.071,198533,"['TranslationsEspañolСрпскиEnglishPolskiItalianoEnglishفارسیDeath by a Thousand Cuts Lyrics[Intro]', 'My, my, my, my', 'My, my, my, my', 'My, my, my, my', 'My, my, my, my', 'My, my, my, my', 'My, my, my, my', 'My, my, my, my', 'My, my, my, my', '', '[Chorus]', 'Saying goodbye is death by a thousand cuts', 'Flashbacks waking me up', ""I get drunk, but it's not enough"", ""’Cause the morning comes and you're not my baby"", 'I look through the windows of this love', 'Even though we boarded them up', ""Chandelier's still flickering here"", ""’Cause I can't pretend it's okay when it's not"", ""It's death by a thousand cuts"", '[Verse 1]', 'I dress to kill my time, I take the long way home', ""I ask the traffic lights if it'll be alright"", 'They say, ""I don\'t know""', ""And what once was ours is no one's now"", 'I see you everywhere, the only thing we share', 'Is this small town', 'You said it was a great love, one for the ages', 'But if the story’s over, why am I still writing pages?', '', '[Chorus]', '’Cause saying goodbye is death by a thousand cuts', 'Flashbacks waking me up', ""I get drunk, but it's not enough"", ""’Cause the morning comes and you're not my baby"", 'I look through the windows of this love', 'Even though we boarded them up', ""Chandelier's still flickering here"", ""'Cause I can’t pretend it's okay when it's not"", ""It's death by a thousand cuts"", '', '[Verse 2]', 'My heart, my hips, my body, my love', ""Tryna find a part of me that you didn't touch"", 'Gave up on me like I was a bad drug', ""Now I'm searching for signs in a haunted club"", 'Our songs, our films, united we stand', 'Our country, guess it was a lawless land', 'Quiet my fears with the touch of your hand', 'Paper cut stings from our paper-thin plans', 'My time, my wine, my spirit, my trust', ""Tryna find a part of me you didn't take up"", ""Gave you so much, but it wasn't enough"", ""But I'll be alright, it's just a thousand cuts"", 'You might also like[Chorus]', ""I get drunk, but it's not enough"", ""'Cause you're not my baby"", 'I look through the windows of this love', 'Even though we boarded them up', ""Chandelier's still flickering here"", ""'Cause I can't pretend it's okay when it's not"", ""No, it's not"", ""It's death by a thousand cuts (You didn't touch)"", '', '[Post-Chorus]', ""Tryna find a part of me that you didn't touch"", ""My body, my love, my trust (It's death by a thousand cuts)"", ""But it wasn't enough, it wasn't enough, no, no"", '', '[Outro]', 'I take the long way home', ""I ask the traffic lights if it'll be alright"", 'They say, ""I don\'t know""76Embed']",https://genius.com/Taylor-swift-death-by-a-thousand-cuts-lyrics
spotify:track:1LLXZFeAHK9R4xUramtUKw,11,London Boy,Lover,Taylor Swift,False,0.695,0.71,1,-6.639,0.05,0.0246,0.000104,0.133,0.557,157.925,190240,"['TranslationsEspañolHrvatskiPortuguêsPolskiFrançaisTaylor Swift - London Boy (Traduzione Italiana)London Boy Lyrics[Intro: Idris Elba & James Corden]', 'We can go driving in, on my scooter', ""Uh, you know, just 'round London"", ""Oh, I'd..."", '', '[Verse 1]', 'I love my hometown as much as Motown, I love SoCal', 'And you know I love Springsteen, faded blue jeans, Tennessee whiskey', 'But something happened, I heard him laughing', 'I saw the dimples first and then I heard the accent', 'They say home is where the heart is', ""But that's not where mine lives"", '[Chorus]', 'You know I love a London boy', 'I enjoy walking Camden Market in the afternoon', 'He likes my American smile, like a child when our eyes meet', 'Darling, I fancy you', 'Took me back to Highgate, met all of his best mates', 'So I guess all the rumors are true', 'You know I love a London boy', 'Boy, I fancy you (Ooh)', '', '[Verse 2]', 'And now I love high tea, stories from Uni, and the West End', 'You can find me in the pub, we are watching rugby with his school friends', 'Show me a gray sky, a rainy cab ride', ""Babes, don't threaten me with a good time"", 'They say home is where the heart is', 'But God, I love the English', '', '[Chorus]', 'You know I love a London boy, I enjoy nights in Brixton', 'Shoreditch in the afternoon', 'He likes my American smile, like a child when our eyes meet', 'Darling, I fancy you', 'Took me back to Highgate, met all of his best mates', 'So I guess all the rumors are true', 'You know I love a London boy', 'Boy, I fancy you', 'You might also like[Bridge]', 'So please show me Hackney', ""Doesn't have to be Louis V up on Bond Street"", 'Just wanna be with you', 'Wanna be with you', ""Stick with me, I'm your queen"", 'Like a Tennessee Stella McCartney on the Heath', 'Just wanna be with you (Wanna be with you)', 'Wanna be with you (Oh)', '', '[Chorus]', 'You know I love a London boy, I enjoy walking Soho', 'Drinking in the afternoon (Yeah)', 'He likes my American smile, like a child when our eyes meet', 'Darling, I fancy you (You)', 'Took me back to Highgate, met all of his best mates', 'So I guess all the rumors are true (Yeah)', 'You know I love a London boy (Oh)', 'Boy (Oh), I fancy you (I fancy you, ooh)', '', '[Outro]', 'So please show me Hackney', ""Doesn't have to be Louis V up on Bond Street"", 'Just wanna be with you', 'I, I, I fancy you', 'Oh whoa, oh, I', ""Stick with me, I'm your queen"", 'Like a Tennessee Stella McCartney on the Heath', 'Just wanna be with you (Ooh)', 'Wanna be with you', 'I fancy you (Yeah), I fancy you', 'Oh whoa, ah44Embed']",https://genius.com/Taylor-swift-london-boy-lyrics
spotify:track:4AYtqFyFbX0Xkc2wtcygTr,12,Soon You’ll Get Better (feat. The Chicks),Lover,Taylor Swift,False,0.433,0.182,0,-12.566,0.0641,0.907,0.0,0.123,0.421,207.476,201587,"['TranslationsTürkçeEspañolСрпскиPortuguêsPolskiItalianoMagyarFrançaisSoon You’ll Get Better Lyrics[Verse 1: Taylor Swift]', 'The buttons of my coat were tangled in my hair', ""In doctor's office lighting, I didn't tell you I was scared"", 'That was the first time we were there', 'Holy orange bottles, each night, I pray to you', 'Desperate people find faith, so now I pray to Jesus too', 'And I say to you...', '', '[Chorus: Taylor Swift & The Chicks]', 'Ooh-ah', ""Soon, you'll get better"", 'Ooh-ah', ""Soon, you'll get better"", 'Ooh-ah', ""You'll get better soon"", ""'Cause you have to"", '[Verse 2: Taylor Swift]', 'I know delusion when I see it in the mirror', 'You like the nicer nurses, you make the best of a bad deal', ""I just pretend it isn't real"", ""I'll paint the kitchen neon, I'll brighten up the sky"", ""I know I'll never get it, there's not a day that I won't try"", 'And I say to you...', '', '[Chorus: Taylor Swift & The Chicks]', 'Ooh-ah', ""Soon, you'll get better"", 'Ooh-ah', ""Soon, you'll get better"", 'Ooh-ah', ""You'll get better soon"", ""'Cause you have to"", '', '[Bridge: Taylor Swift & The Chicks]', 'And I hate to make this all about me', 'But who am I supposed to talk to?', 'What am I supposed to do', ""If there's no you?"", '', '[Pre-Chorus: Taylor Swift]', ""This won't go back to normal, if it ever was"", ""It's been years of hoping, and I keep saying it because"", ""'Cause I have to"", 'You might also like[Chorus: Taylor Swift & The Chicks]', 'Ooh-ah', ""You'll get better"", 'Ooh-ah', ""Soon, you'll get better"", 'Ooh-ah', ""You'll get better soon"", 'Ooh-ah', ""Soon, you'll get better"", 'Ooh-ah', ""Soon, you'll get better"", 'Ooh-ah', ""You'll get better soon"", ""'Cause you have to44Embed""]",https://genius.com/Taylor-swift-soon-youll-get-better-lyrics
spotify:track:5hQSXkFgbxjZo9uCwd11so,13,False God,Lover,Taylor Swift,False,0.739,0.32,11,-10.862,0.239,0.736,0.000147,0.111,0.351,79.97,200307,"['TranslationsTürkçeEspañolHrvatskiPortuguêsPolskiItalianoMagyarFrançaisFalse God Lyrics[Verse 1]', 'We were crazy to think', 'Crazy to think that this could work', ""Remember how I said I'd\u2005die\u2005for you?"", 'We were\u2005stupid to jump', 'In the ocean separating\u2005us', 'Remember how I’d fly to you?', '', '[Pre-Chorus]', ""And I can't talk to you when you're like this"", 'Staring out the window like I’m not your favorite town', ""I'm New York City"", 'I still do it for you, babe', 'They all warned us about times like this', 'They say the road gets hard and you get lost', ""When you're led by blind faith, blind faith"", '[Chorus]', 'But we might just get away with it', ""Religion's in your lips"", ""Even if it's a false god"", ""We'd still worship"", 'We might just get away with it', 'The altar is my hips', ""Even if it's a false god"", ""We'd still worship this love"", 'We’d still worship this love', 'We’d still worship this love', '', '[Verse 2]', ""I know heaven's a thing"", 'I go there when you touch me, honey', 'Hell is when I fight with you', 'But we can patch it up good', 'Make confessions and we’re begging for forgiveness', 'Got the wine for you', '', '[Pre-Chorus]', ""And you can't talk to me when I'm like this"", 'Daring you to leave me just so I can try and scare you', ""You're the West Village"", 'You still do it for me, babe', 'They all warned us about times like this', 'They say the road gets hard and you get lost', 'When you’re led by blind faith, blind faith', 'You might also like[Chorus]', 'But we might just get away with it', ""Religion's in your lips"", ""Even if it's a false god"", ""We'd still worship"", 'We might just get away with it', 'The altar is my hips', ""Even if it's a false god"", ""We'd still worship this love"", ""We'd still worship this love"", ""We'd still worship this love, ah"", '', '[Outro]', 'Still worship this love', ""Even if it's a false god"", ""Even if it's a false god"", 'Still worship this love68Embed']",https://genius.com/Taylor-swift-false-god-lyrics
spotify:track:6RRNNciQGZEXnqk8SQ9yv5,14,You Need To Calm Down,Lover,Taylor Swift,False,0.771,0.671,2,-5.617,0.0553,0.00929,0.0,0.0637,0.714,85.026,171360,"['TranslationsEspañolСрпскиPortuguêsPolskiDeutschTaylor Swift - You Need to Calm Down (Traduzione Italiana)FrançaisEnglishNederlandsYou Need To Calm Down Lyrics[Verse 1]', ""You are somebody that I don't know"", ""But you're takin' shots at me like it's Patrón"", ""And I'm just like, damn, it's 7 AM"", ""Say it in the street, that's a knock-out"", ""But you say it in a Tweet, that's a cop-out"", 'And I\'m just like, ""Hey, are you okay?""', '', '[Pre-Chorus]', ""And I ain't tryna mess with your self-expression"", ""But I've learned a lesson that stressin' and obsessin' 'bout somebody else is no fun"", 'And snakes and stones never broke my bones', '[Chorus]', 'So oh-oh, oh-oh, oh-oh, oh-oh, oh-oh', ""You need to calm down, you're being too loud"", ""And I'm just like oh-oh, oh-oh, oh-oh, oh-oh, oh-oh (Oh)"", 'You need to just stop, like can you just not step on my gown?', 'You need to calm down', '', '[Verse 2]', ""You are somebody that we don't know"", ""But you're comin' at my friends like a missile"", 'Why are you mad when you could be GLAAD? (You could be GLAAD)', 'Sunshine on the street at the parade', 'But you would rather be in the dark ages', ""Makin' that sign must've taken all night"", '', '[Pre-Chorus]', 'You just need to take several seats and then try to restore the peace', 'And control your urges to scream about all the people you hate', ""'Cause shade never made anybody less gay"", '', '[Chorus]', 'So oh-oh, oh-oh, oh-oh, oh-oh, oh-oh', ""You need to calm down, you're being too loud"", ""And I'm just like oh-oh, oh-oh, oh-oh, oh-oh, oh-oh (Oh)"", 'You need to just stop, like can you just not step on his gown?', 'You need to calm down', 'You might also like[Bridge]', 'And we see you over there on the internet', 'Comparing all the girls who are killing it', 'But we figured you out', 'We all know now we all got crowns', 'You need to calm down', '', '[Chorus]', 'Oh-oh, oh-oh, oh-oh, oh-oh, oh-oh', 'You need to calm down (You need to calm down)', ""You're being too loud (You're being too loud)"", ""And I'm just like oh-oh, oh-oh, oh-oh, oh-oh, oh-oh (Oh)"", 'You need to just stop (Can you stop?)', 'Like can you just not step on our gowns?', 'You need to calm down123Embed']",https://genius.com/Taylor-swift-you-need-to-calm-down-lyrics
spotify:track:1SymEzIT3H8UZfibCs3TYi,15,Afterglow,Lover,Taylor Swift,False,0.756,0.449,9,-8.746,0.0344,0.13,0.0,0.114,0.399,111.011,223293,"['TranslationsEspañolСрпскиPortuguêsPolskiTaylor Swift - Afterglow (Traduzione Italiana)Afterglow Lyrics[Verse 1]', ""I blew things out of proportion, now you're blue"", 'Put you in jail for something you\u2005didn’t\u2005do', 'I pinned your\u2005hands behind your back, oh', 'Thought I\u2005had reason to attack, but no', '', '[Pre-Chorus 1]', 'Fighting with a true love is boxing with no gloves', ""Chemistry 'til it blows up, 'til there’s no us"", ""Why'd I have to break what I love so much?"", ""It's on your face, and I'm to blame, I need to say"", '[Chorus]', ""Hey, it's all me, in my head"", ""I'm the one who burned us down"", ""But it's not what I meant"", 'Sorry that I hurt you', ""I don't wanna do, I don’t wanna do this to you (Ooh)"", ""I don’t wanna lose, I don't wanna lose this with you (Ooh)"", ""I need to say, hey, it’s all me, just don't go"", 'Meet me in the afterglow', '', '[Verse 2]', ""It's so excruciating to see you low"", 'Just wanna lift you up and not let you go', 'This ultraviolet morning light below', 'Tells me this love is worth the fight, oh', '', '[Pre-Chorus 2]', 'I lived like an island, punished you with silence', 'Went off like sirens, just crying', ""Why'd I have to break what I love so much?"", ""It’s on your face, don't walk away, I need to say"", '', '[Chorus]', ""Hey, it's all me, in my head"", ""I'm the one who burned us down"", ""But it's not what I meant"", ""I'm sorry that I hurt you"", ""I don't wanna do, I don't wanna do this to you (Ooh)"", ""I don't wanna lose, I don't wanna lose this with you (Ooh)"", ""I need to say, hey, it's all me, just don't go"", 'Meet me in the afterglow', 'You might also like[Bridge]', ""Tell me that you're still mine"", ""Tell me that we'll be just fine"", 'Even when I lose my mind', 'I need to say', ""Tell me that it's not my fault"", ""Tell me that I'm all you want"", 'Even when I break your heart', 'I need to say', '', '[Chorus]', ""Hey, it's all me, in my head"", ""I'm the one who burned us down"", ""But it's not what I meant"", 'Sorry that I hurt you', ""I don't wanna do, I don't wanna do this to you (Ooh)"", ""I don't wanna lose, I don't wanna lose this with you (Ooh)"", ""I need to say, hey, it's all me, just don't go"", 'Meet me in the afterglow66Embed']",https://genius.com/Taylor-swift-afterglow-lyrics
spotify:track:2Rk4JlNc2TPmZe2af99d45,16,ME! (feat. Brendon Urie of Panic! At The Disco),Lover,Taylor Swift,False,0.61,0.83,0,-4.105,0.0571,0.033,0.0,0.118,0.728,182.162,193000,"['TranslationsTürkçeไทย / Phasa ThaiPolskiСрпскиPortuguêsPolski한국어ItalianoFrançaisNederlandsDanskME! Lyrics[Intro: Taylor Swift]', ""I promise that you'll never find another like me"", '', '[Verse 1: Taylor Swift]', ""I know that I'm a handful, baby, uh"", 'I know I never think before I jump', ""And you're the kind of guy the ladies want"", ""(And there's a lotta cool chicks out there)"", 'I know that I went psycho on the phone', 'I never leave well enough alone', ""And trouble's gonna follow where I go"", ""(And there's a lotta cool chicks out there)"", '[Pre-Chorus: Taylor Swift]', 'But one of these things is not like the others', 'Like a rainbow with all of the colors', 'Baby doll, when it comes to a lover', ""I promise that you'll never find another like"", '', '[Chorus: Taylor Swift]', 'Me-e-e, ooh-ooh-ooh-ooh', ""I'm the only one of me"", ""Baby, that's the fun of me"", 'Eeh-eeh-eeh, ooh-ooh-ooh-ooh', ""You're the only one of you"", ""Baby, that's the fun of you"", ""And I promise that nobody's gonna love you like me-e-e"", '', '[Verse 2: Brendon Urie, Taylor Swift]', 'I know I tend to make it about me', 'I know you never get just what you see', 'But I will never bore you, baby', ""(And there's a lotta lame guys out there)"", 'And when we had that fight out in the rain', 'You ran after me and called my name', 'I never wanna see you walk away', ""(And there's a lotta lame guys out there)"", '', '[Pre-Chorus: Both, Brendon Urie]', ""'Cause one of these things is not like the others"", ""Livin' in winter, I am your summer"", 'Baby doll, when it comes to a lover', ""I promise that you'll never find another like"", 'You might also like[Chorus: Brendon Urie, Both]', 'Me-e-e, ooh-ooh-ooh-ooh', ""I'm the only one of me"", 'Let me keep you company', 'Eeh-eeh-eeh, ooh-ooh-ooh-ooh', ""You're the only one of you"", ""Baby, that's the fun of you"", ""And I promise that nobody's gonna love you like me-e-e"", '', '[Bridge: Brendon Urie, Taylor Swift, Both]', 'Girl, there ain\'t no ""I"" in ""team""', 'But you know there is a ""me""', 'Strike the band up, one, two, three', ""I promise that you'll never find another like me"", 'Girl, there ain\'t no ""I"" in ""team""', 'But you know there is a ""me""', 'And you can\'t spell ""awesome"" without ""me""', ""I promise that you'll never find another like"", '', '[Chorus: Both, Taylor Swift, Brendon Urie]', 'Me-e-e (Yeah), ooh-ooh-ooh-ooh (And I want ya, baby)', ""I'm the only one of me (I'm the only one of me)"", ""Baby, that's the fun of me (Baby, that's the fun of me)"", 'Eeh-eeh-eeh, ooh-ooh-ooh-ooh (Oh)', ""You're the only one of you (Oh)"", ""Baby, that's the fun of you"", ""And I promise that nobody's gonna love you like me-e-e"", '[Outro: Brendon Urie, Taylor Swift, Both]', 'Girl, there ain\'t no ""I"" in ""team"" (Ooh-ooh-ooh-ooh)', 'But you know there is a ""me""', ""I'm the only one of me (Oh-oh)"", ""Baby, that's the fun of me"", '(Eeh-eeh-eeh, ooh-ooh-ooh-ooh)', 'Strike the band up, one, two, three', 'You can\'t spell ""awesome"" without ""me""', ""You're the only one of you (Yeah, yeah)"", ""Baby, that's the fun of you"", ""And I promise that nobody's gonna love you like me-e-e122Embed""]",https://genius.com/Taylor-swift-me-lyrics
spotify:track:1SmiQ65iSAbPto6gPFlBYm,17,It’s Nice To Have A Friend,Lover,Taylor Swift,False,0.737,0.175,10,-9.912,0.0401,0.971,0.000337,0.171,0.545,70.008,150440,"['TranslationsTürkçeEspañolСрпскиPortuguêsPolskiItalianoMagyarFrançaisIt’s Nice to Have a Friend Lyrics[Intro]', 'Ooh', 'Ooh', '', '[Verse 1]', 'School bell rings, walk me home', 'Sidewalk chalk covered in snow', 'Lost my gloves, you give me one', '""Wanna hang out?"" Yeah, sounds like fun', 'Video games, you pass me a note', 'Sleeping in tents', '[Chorus]', ""It's nice to have a friend (Ooh)"", ""It's nice to have a friend (Ooh)"", '', '[Verse 2]', 'Light pink sky, up on the roof', 'Sun sinks down, no curfew', '20 questions, we tell the truth', ""You've been stressed out lately, yeah, me too"", 'Something gave you the nerve', 'To touch my hand', '', '[Chorus]', ""It's nice to have a friend (Ooh)"", ""It's nice to have a friend (Ooh)"", '', '[Instrumental bridge]', '', '[Verse 3]', 'Church bells ring, carry me home', 'Rice on the ground looks like snow', 'Call my bluff, call you ""Babe""', 'Have my back, yeah, every day', 'Feels like home, stay in bed', 'The whole weekend', 'You might also like[Chorus]', ""It's nice to have a friend (Ooh)"", ""It's nice to have a friend (Ooh)"", ""It's nice to have a friend (Ooh)"", '(Ooh)50Embed']",https://genius.com/Taylor-swift-its-nice-to-have-a-friend-lyrics
spotify:track:1fzAuUVbzlhZ1lJAx9PtY6,18,Daylight,Lover,Taylor Swift,False,0.557,0.496,0,-9.602,0.0563,0.808,0.000173,0.0772,0.265,149.983,293453,"['TranslationsEspañolHrvatskiPortuguêsPolskiTaylor Swift - Daylight (Traduzione Italiana)FrançaisDaylight Lyrics[Verse 1]', 'My love was as cruel as the cities I lived in', 'Everyone looked worse in the light', ""There are so many lines that I've crossed unforgiven"", ""I'll tell you the truth, but never goodbye"", '', '[Chorus]', ""I don't wanna look at anything else now that I saw you"", ""I don't wanna think of anything else now that I thought of you"", ""I've been sleeping so long in a 20-year dark night"", 'And now I see daylight, I only see daylight', '[Verse 2]', 'Luck of the draw only draws the unlucky', 'And so I became the butt of the joke', 'I wounded the good and I trusted the wicked', 'Clearing the air, I breathed in the smoke', 'Maybe you ran with the wolves and refused to settle down', ""Maybe I've stormed out of every single room in this town"", ""Threw out our cloaks and our daggers because it's morning now"", ""It's brighter now, now"", '', '[Chorus]', ""I don't wanna look at anything else now that I saw you"", '(I can never look away)', ""I don't wanna think of anything else now that I thought of you"", '(Things will never be the same)', ""I've been sleeping so long in a 20-year dark night"", ""(Now I'm wide awake)"", 'And now I see daylight (Daylight), I only see daylight (Daylight)', 'I only see daylight, daylight, daylight, daylight', 'I only see daylight, daylight, daylight, daylight', '', '[Bridge]', 'And I can still see it all (In my mind)', 'All of you, all of me (Intertwined)', 'I once believed love would be (Black and white)', ""But it's golden (Golden)"", 'And I can still see it all (In my head)', 'Back and forth from New York (Sneaking in your bed)', 'I once believed love would be (Burning red)', ""But it's golden"", 'Like daylight, like daylight', 'Like daylight, daylight', 'You might also like[Chorus]', ""I don't wanna look at anything else now that I saw you"", '(I can never look away)', ""And I don't wanna think of anything else now that I thought of you"", '(Things will never be the same)', ""I've been sleeping so long in a 20-year dark night"", ""(Now I'm wide awake)"", 'And now I see daylight (I see daylight), I only see daylight (Ah)', 'I only see daylight, daylight, daylight, daylight', 'I only see daylight, daylight, daylight, daylight (Ah)', '(And I can still see it all)', 'I only see daylight, daylight, daylight, daylight', '(And I can still see it all, back and forth from New York)', 'I only see daylight, daylight, daylight, daylight', '(I once believed love would be burning red)', '', '[Outro]', 'Like daylight', ""It's golden like daylight"", 'You gotta step into the daylight and let it go', 'Just let it go, let it go', '[Spoken Outro]', 'I wanna be defined by the things that I love', 'Not the things I hate', ""Not the things I'm afraid of, I'm afraid of"", 'Or the things that haunt me in the middle of the night', 'I, I just think that', 'You are what you love61Embed']",https://genius.com/Taylor-swift-daylight-lyrics
